{
  "schema_version": "0.1",
  "review_id": "m5-provisional-m2-012-person-a-review-1",
  "context_id": "m5-provisional-m2-012-person-a-context",
  "reviewer_id": "human-user-person-a",
  "checks": {
    "mathematically_valid": true,
    "resolves_failed_inference": true,
    "theorem_preserved": true,
    "assumptions_preserved": true,
    "domain_preserved": true,
    "unrelated_branches_preserved": true,
    "no_new_errors": true,
    "operationally_minimal": true
  },
  "hidden_assumptions": [],
  "introduced_errors": [],
  "deletion_trials": [{
    "edit_id": "insert_before:2a",
    "removal_breaks_repair": true,
    "reason": "Removing the sole bridge restores the omitted substitution and divisibility-witness inference."
  }],
  "evidence_used": ["certificate:m2-012-m3-gap-node-2-v1", "source:m2-012-frozen-theorem-and-proof"],
  "accepted": true,
  "rejection_codes": [],
  "reason": "The human user explicitly replied 'accept' after reviewing the proposed substitution-and-witness bridge."
}

