{
  "schema_version": "0.1",
  "review_id": "m5-batch-m2-044-review-r2",
  "context_id": "m5-batch-m2-044-context-r2",
  "reviewer_id": "human-user-person-a",
  "checks": {
    "mathematically_valid": true,
    "resolves_failed_inference": true,
    "theorem_preserved": true,
    "assumptions_preserved": true,
    "domain_preserved": true,
    "unrelated_branches_preserved": true,
    "no_new_errors": true,
    "operationally_minimal": true
  },
  "hidden_assumptions": [],
  "introduced_errors": [],
  "deletion_trials": [
    {
      "edit_id": "replace:2",
      "removal_breaks_repair": true,
      "reason": "Removing this accepted batch edit restores the certified error."
    }
  ],
  "evidence_used": [
    "certificate:m2-044-batch-v0.2-error-r2",
    "batch-ledger:batch-m2-044-045-046-047-v0.2"
  ],
  "accepted": true,
  "rejection_codes": [],
  "reason": "Accepted by the human user in the explicitly scoped batch review."
}
