{"schema_version":"0.1","review_id":"m5-provisional-m2-022-person-a-review-1","context_id":"m5-provisional-m2-022-person-a-context","reviewer_id":"human-user-person-a","checks":{"mathematically_valid":true,"resolves_failed_inference":true,"theorem_preserved":true,"assumptions_preserved":true,"domain_preserved":true,"unrelated_branches_preserved":true,"no_new_errors":true,"operationally_minimal":true},"hidden_assumptions":[],"introduced_errors":[],"deletion_trials":[{"edit_id":"mark_irreparable:2","removal_breaks_repair":true,"reason":"Removing the irreparable disposition would leave the false theorem unresolved; a proof-producing change would require a new assumption."}],"evidence_used":["certificate:m2-022-m3-false-theorem-node-2-v1","source:m2-022-frozen-theorem-and-proof"],"accepted":true,"rejection_codes":[],"reason":"The human user explicitly accepted the irreparable classification supported by x=1 and y=-1."}
